{
  "kind": "counter",
  "techniques": [
    "tsurikomi-goshi",
    "yoko-guruma"
  ],
  "trigger": null,
  "direction": null,
  "about": {
    "en": "A partner turned in for the lifting-pulling hip throw can be wheeled: wrapping the waist and throwing yourself down to the side takes them over your body."
  },
  "described": null,
  "receiving": null,
  "viNotes": null,
  "videos": [],
  "resolver": null,
  "source": {
    "sourceId": "judo-sequences-2026"
  }
}
