{
  "kind": "counter",
  "techniques": [
    "o-soto-gari",
    "ko-soto-gake"
  ],
  "trigger": "lifts-leg",
  "direction": null,
  "about": {
    "en": "Lifting the attacked leg over the major outer reap and hooking your partner's standing heel from the outside takes them backwards over the leg the reap depended on."
  },
  "described": null,
  "receiving": null,
  "viNotes": null,
  "videos": [],
  "resolver": null,
  "source": {
    "sourceId": "judo-sequences-2026"
  }
}
