{
  "kind": "combination",
  "techniques": [
    "sasae-tsurikomi-ashi",
    "seoi-otoshi"
  ],
  "trigger": "pulls-back",
  "direction": "same",
  "about": {
    "en": "A partner leaning forward after stepping back from the prop is taken by dropping under them: the dropping shoulder throw finishes the wheel that the prop began."
  },
  "described": null,
  "receiving": null,
  "viNotes": null,
  "videos": [],
  "resolver": null,
  "source": {
    "sourceId": "judo-sequences-2026"
  }
}
