{
  "kind": "counter",
  "techniques": [
    "de-ashi-harai",
    "okuri-ashi-harai"
  ],
  "trigger": null,
  "direction": null,
  "about": {
    "en": "A partner who sweeps at your advancing foot has both of their own feet moving together to reach it. Lifting the foot over the sweep and sweeping both of theirs through in the same instant is the double foot sweep, and the timing they chose is the timing you use."
  },
  "described": null,
  "receiving": null,
  "viNotes": null,
  "videos": [],
  "resolver": null,
  "source": {
    "sourceId": "judo-sequences-2026"
  }
}
