{
  "kind": "transition",
  "techniques": [
    "uki-waza",
    "kesa-gatame"
  ],
  "trigger": null,
  "direction": null,
  "about": {
    "en": "Stopping the roll of the floating throw at your partner's side, with the sleeve still in hand, leaves you sitting by their head. An arm round the neck from there is the scarf hold."
  },
  "described": null,
  "receiving": null,
  "viNotes": null,
  "videos": [],
  "resolver": null,
  "source": {
    "sourceId": "judo-sequences-2026"
  }
}
