{
  "kind": "transition",
  "techniques": [
    "ko-soto-gari",
    "ushiro-kesa-gatame"
  ],
  "trigger": null,
  "direction": null,
  "about": {
    "en": "After the minor outer reap you are behind your partner's shoulder as they land. Dropping beside the head facing their feet with the near arm gathered is the rear scarf hold."
  },
  "described": null,
  "receiving": null,
  "viNotes": null,
  "videos": [],
  "resolver": null,
  "source": {
    "sourceId": "judo-sequences-2026"
  }
}
