{
  "kind": "chain",
  "techniques": [
    "hadaka-jime",
    "okuri-eri-jime"
  ],
  "trigger": null,
  "direction": null,
  "about": {
    "en": "A partner who tucks their chin against the naked strangle has protected the throat and offered the collar. Feeding one hand deep into the far lapel turns the same position behind them into the sliding collar strangle, which does not need the chin to lift."
  },
  "described": null,
  "receiving": null,
  "viNotes": null,
  "videos": [],
  "resolver": null,
  "source": {
    "sourceId": "judo-sequences-2026"
  }
}
