{
  "kind": "counter",
  "techniques": [
    "tsurikomi-goshi",
    "ko-soto-gake"
  ],
  "trigger": "blocks-hip",
  "direction": null,
  "about": {
    "en": "Blocking the lifting-pulling hip throw leaves your partner's near heel beside your foot. Hooking it from the outside takes them backwards over it."
  },
  "described": null,
  "receiving": null,
  "viNotes": null,
  "videos": [],
  "resolver": null,
  "source": {
    "sourceId": "judo-sequences-2026"
  }
}
