{
  "kind": "transition",
  "techniques": [
    "koshi-guruma",
    "kata-gatame"
  ],
  "trigger": null,
  "direction": null,
  "about": {
    "en": "After the hip wheel the arm you held the neck with is still there, and your partner's near arm is loose beside it. Pushing that arm across their neck and clamping it with your head is the shoulder hold."
  },
  "described": null,
  "receiving": null,
  "viNotes": null,
  "videos": [],
  "resolver": null,
  "source": {
    "sourceId": "judo-sequences-2026"
  }
}
