{
  "kind": "combination",
  "techniques": [
    "tai-otoshi",
    "ko-soto-gari"
  ],
  "trigger": "steps-around",
  "direction": "opposite",
  "about": {
    "en": "A partner who steps round the body drop puts a heel down beside your foot. Reaping it from the outside takes the leg they stepped onto."
  },
  "described": null,
  "receiving": null,
  "viNotes": null,
  "videos": [],
  "resolver": null,
  "source": {
    "sourceId": "judo-sequences-2026"
  }
}
