{
  "kind": "counter",
  "techniques": [
    "yoko-tomoe-nage",
    "tawara-gaeshi"
  ],
  "trigger": null,
  "direction": null,
  "about": {
    "en": "A partner who bends in low to drop for the side circle throw has their head at your hip. Wrapping both arms round the waist and lifting them over your head before they drop is the rice-bag reversal."
  },
  "described": null,
  "receiving": null,
  "viNotes": null,
  "videos": [],
  "resolver": null,
  "source": {
    "sourceId": "judo-sequences-2026"
  }
}
