{
  "kind": "counter",
  "techniques": [
    "ippon-seoi-nage",
    "waki-gatame"
  ],
  "trigger": null,
  "direction": null,
  "about": {
    "en": "The arm a partner offers for the one-arm shoulder throw can be trapped under your armpit as they turn. Applied standing, this draws a shido where uke can escape and hansoku-make where they cannot, so it is a dojo answer and a groundwork one. Joint locks carry age limits; learn it under instruction."
  },
  "described": null,
  "receiving": null,
  "viNotes": null,
  "videos": [],
  "resolver": null,
  "source": {
    "sourceId": "judo-sequences-2026"
  }
}
