{
  "kind": "counter",
  "techniques": [
    "de-ashi-harai",
    "de-ashi-harai"
  ],
  "trigger": "over-commits",
  "direction": null,
  "about": {
    "en": "The foot sweep is its own mirror counter: a partner whose sweep misses has their sweeping foot in the air and their weight on the other one, and sweeping that supporting foot as it takes the weight sends the same throw back."
  },
  "described": null,
  "receiving": null,
  "viNotes": null,
  "videos": [],
  "resolver": null,
  "source": {
    "sourceId": "judo-sequences-2026"
  }
}
