{
  "kind": "transition",
  "techniques": [
    "o-uchi-gake",
    "tate-shiho-gatame"
  ],
  "trigger": null,
  "direction": null,
  "about": {
    "en": "The major inner hook drives your partner down with you on top of them between the legs. Pinning a knee and stepping the hip across takes you astride, and the lengthways hold follows."
  },
  "described": null,
  "receiving": null,
  "viNotes": null,
  "videos": [],
  "resolver": null,
  "source": {
    "sourceId": "judo-sequences-2026"
  }
}
